[
  {"evidence_id":"EVID-D001","source_type":"chat_log","timestamp":"2026-05-10T14:00:00","entity_refs":["PERSON-Priya","PERSON-Raj"],"content":"Priya messaged Raj: 'send me the account details'.","confidence":0.9,"raw_source_file":"synthetic_case_v3/raw/chat1.csv"},
  {"evidence_id":"EVID-D002","source_type":"network_log","timestamp":"2026-05-10T14:15:00","entity_refs":["PERSON-Raj","IP-10.0.0.7"],"content":"IP 10.0.0.7 accessed the company financial server.","confidence":0.9,"raw_source_file":"synthetic_case_v3/raw/net1.csv"},
  {"evidence_id":"EVID-D003","source_type":"file_metadata","timestamp":"2026-05-10T14:20:00","entity_refs":["PERSON-Raj","DEVICE-RajPC"],"content":"File 'accounts_q1.xlsx' downloaded on Raj's PC.","confidence":0.85,"raw_source_file":"synthetic_case_v3/raw/file1.csv"},
  {"evidence_id":"EVID-D004","source_type":"call_log","timestamp":"2026-05-10T15:00:00","entity_refs":["PERSON-Priya","PERSON-Raj"],"content":"Priya called Raj, call lasted 3 minutes.","confidence":0.95,"raw_source_file":"synthetic_case_v3/raw/call1.csv"}
]